{
  "$schema": "https://json-schema.org/draft/2020-12/schema",
  "$id": "https://immu4989.github.io/awesome-agentic-usecases/schemas/agent-side-effect-release-binding-plan-0.3.json",
  "title": "AAU Agent Side-Effect Release Binding Plan 0.3",
  "type": "object",
  "additionalProperties": false,
  "required": ["binding_version", "binding_id", "agent_id", "release_id", "authority_conformance", "bindings", "boundaries"],
  "properties": {
    "binding_version": {"const": "aau-agent-side-effect-release-binding-plan/0.3"},
    "binding_id": {"$ref": "#/$defs/text160"},
    "agent_id": {"$ref": "#/$defs/text160"},
    "release_id": {"$ref": "#/$defs/text160"},
    "authority_conformance": {
      "type": "object",
      "additionalProperties": false,
      "required": ["suite", "receipt", "adapter"],
      "properties": {
        "suite": {"$ref": "#/$defs/relativePath"},
        "receipt": {"$ref": "#/$defs/relativePath"},
        "adapter": {"$ref": "#/$defs/relativePath"}
      }
    },
    "bindings": {
      "type": "array",
      "minItems": 1,
      "maxItems": 50,
      "items": {
        "type": "object",
        "additionalProperties": false,
        "required": ["tool_id", "operation", "resource_scope", "semantic_adapter", "crash_adapter", "race_adapter"],
        "properties": {
          "tool_id": {"type": "string", "minLength": 1, "maxLength": 120},
          "operation": {"$ref": "#/$defs/text160"},
          "resource_scope": {"type": "string", "minLength": 1, "maxLength": 300},
          "semantic_adapter": {"$ref": "#/$defs/relativePath"},
          "crash_adapter": {"$ref": "#/$defs/relativePath"},
          "race_adapter": {"$ref": "#/$defs/relativePath"}
        }
      }
    },
    "boundaries": {
      "type": "object",
      "additionalProperties": false,
      "required": ["public_synthetic_staging_only", "adapter_paths_workspace_relative", "all_consequential_relationships_must_be_bound", "human_approval_required_for_consequential_authority", "authority_conformance_must_be_command_artifact_bound", "no_production_identity_or_deployment_claim"],
      "properties": {
        "public_synthetic_staging_only": {"const": true},
        "adapter_paths_workspace_relative": {"const": true},
        "all_consequential_relationships_must_be_bound": {"const": true},
        "human_approval_required_for_consequential_authority": {"const": true},
        "authority_conformance_must_be_command_artifact_bound": {"const": true},
        "no_production_identity_or_deployment_claim": {"const": true}
      }
    }
  },
  "$defs": {
    "text160": {"type": "string", "minLength": 1, "maxLength": 160},
    "relativePath": {"type": "string", "minLength": 1, "maxLength": 500, "pattern": "^(?!/)(?!.*(?:^|/)\\.\\.(?:/|$)).+$"}
  }
}
