{
  "binding_version": "aau-agent-side-effect-release-binding-plan/0.3",
  "binding_id": "synthetic-benefit-coordinator-side-effect-release-0.1.0",
  "agent_id": "agent:benefit-coordinator",
  "release_id": "synthetic-benefit-coordinator-0.1.0",
  "authority_conformance": {
    "suite": "agent-side-effect-ledger/examples/release-binding/authority-conformance-suite.json",
    "receipt": "agent-side-effect-ledger/examples/release-binding/authority-conformance-receipt.json",
    "adapter": "agent-side-effect-ledger/examples/release-binding/reference_authority_adapter.py"
  },
  "bindings": [
    {
      "tool_id": "notification-service",
      "operation": "send_synthetic_notice",
      "resource_scope": "synthetic-benefit-cases/notices/*",
      "semantic_adapter": "agent-side-effect-ledger/examples/reference_adapter.py",
      "crash_adapter": "agent-side-effect-ledger/examples/reference_crash_adapter.py",
      "race_adapter": "agent-side-effect-ledger/examples/reference_race_adapter.py"
    }
  ],
  "boundaries": {
    "public_synthetic_staging_only": true,
    "adapter_paths_workspace_relative": true,
    "all_consequential_relationships_must_be_bound": true,
    "human_approval_required_for_consequential_authority": true,
    "authority_conformance_must_be_command_artifact_bound": true,
    "no_production_identity_or_deployment_claim": true
  }
}
